title,content,category,thumbnail,news_views,is_featured
Apakah Arne Slot Akan Dipecat Liverpool???,Arne Slot tengah menghadapi ujian terbesar sejak menangani Liverpool. Rentetan empat kekalahan beruntun membuat posisinya di Anfield mulai dipertanyakan. Pelatih asal Belanda itu menggantikan Jurgen Klopp pada musim panas lalu setelah pelatih asal Jerman tersebut mundur. Slot sempat membawa Liverpool menjuarai Premier League di musim perdananya.,Rumor,https://cdns.klimg.com/bola.net/resized/810x540/library/upload/21/2025/09/996x664/arne-slot-3_b9dcdfb.jpg,0,
4 Pemain Baru Manchester United yang Bantu Ruben Amorim Taklukkan Liverpool di Anfield,Manchester United berhasil meraih kemenangan penting atas Liverpool di Anfield. Hasil ini menandai dua kemenangan beruntun pertama di Premier League bagi Ruben Amorim sejak menjadi pelatih Setan Merah.,Match,https://cdns.klimg.com/bola.net/resized/810x540/library/upload/21/2025/10/996x664/ruben-amorim-manches_a35b0ce.jpg,0
Erling Haaland Lampaui Rekor Cristiano Ronaldo Cetak Gol 12 Laga Beruntun!!,  Erling Haaland menulis sejarah baru di dunia sepak bola. Penyerang Manchester City tersebut baru saja memecahkan rekor milik Cristiano Ronaldo dengan torehan gol dalam 12 pertandingan beruntun di semua ajang termasuk bersama timnas Norwegia.,Analysis,https://cdns.klimg.com/bola.net/resized/810x540/library/upload/21/2025/10/996x664/erling-haaland-manch_ccc3b52.jpg
Eksklusif: Pep Guardiola Ungkap Target Manchester City Musim Ini,Pep Guardiola mengungkapkan bahwa City ingin mempertahankan dominasi di Premier League dan menargetkan gelar Liga Champions kedua mereka.,Exclusive,https://www.mancity.com/meta/media/mcop2sko/burnley-1-pep.jpg?width=1620,0
Analisis: Dominasi Arsenal di Paruh Musim Premier League 2025, Arsenal menunjukkan konsistensi luar biasa di paruh musim Premier League. Dengan lini tengah solid dan pressing tinggi,Analysis,https://library.sportingnews.com/styles/crop_style_16_9_desktop_webp/s3/2025-08/GettyImages-2229282593.jpg.webp?itok=M4GhoCzE,0
